CityTown,Location,County,StateTerritory,Country,Date,EstimateText,EstimateLow,BestGuess,EstimateHigh,AdjustedLow,AdjustedHigh,Actor,Claim,Pro(2)/Anti(1),EventType,ReportedArrests,ReportedParticipantInjuries,ReportedPoliceInjuries,ReportedPropertyDamage,TownsCities,Events,Source1,Source2,Source3,Misc.,TearGas,
Cincinnati,Paul Brown Stadium,,OH,US,2020-09-13,,,,,,,football players,"against racism, against police violence",1,protest,,,,,1,1,https://www.sportingnews.com/us/nfl/news/nfl-player-protests-national-anthem/j2ewh9cume8z1ktdv4um6druk,,,,,
Clayton,outside home of County Executive Sam Page,St. Louis,MO,US,2020-09-13,,,,,,,student athletes; parents ,against postponing fall high school sports season due to COVID-19 pandemic,0,protest,,,,,1,1,https://www.ksdk.com/article/news/health/coronavirus/our-voices-collectively-have-been-heard-parents-plan-petitions-and-protests-against-st-louis-county-sports-restrictions/63-f33f700c-8fd7-4fa1-b595-6528d60ea00c,https://www.stltoday.com/lifestyles/health-med-fit/coronavirus/youth-sports-advocates-rally-again-outside-st-louis-county-government-building/article_777a1bb2-081d-5f64-82eb-7cf613271636.html,,,,
Creve Coeur,outside home of St. Louis County Executive Sam Page,,MO,US,2020-09-13,hundreds,200,,200,,,general protesters,against cancellation of high school sports due to coronavirus pandemic,0,protest,,,,,1,1,http://www.stlamerican.com/news/local_news/black-lives-matter-vs-let-us-play-a-tale-of-two-protest-movements/article_c71282c4-fb9c-11ea-9d41-3718d6680740.html,,,,,
Dayton,Dayton View Park to Salem Bridge,,OH,US,2020-09-13,,,,,,,Black Lives Matter Dayton,"against racism, against police violence",1,march,,,,,1,1,https://www.facebook.com/events/1439682749561607/,,,Black Momma's March. Men and community at large asked to wait at Salem Bridge for Black Mommas to arrive.,,
Detroit,Ford Field,,MI,US,2020-09-13,,,,,,,football players,"against racism, against police violence",1,protest,,,,,1,1,https://www.sportingnews.com/us/nfl/news/nfl-player-protests-national-anthem/j2ewh9cume8z1ktdv4um6druk,,,,,
Foxborough,Gillette Stadium,,MA,US,2020-09-13,,,,,,,football players,"against racism, against police violence",1,protest,,,,,1,1,https://www.sportingnews.com/us/nfl/news/nfl-player-protests-national-anthem/j2ewh9cume8z1ktdv4um6druk,,,,,
Grants,Cibola County Detention Center,,NM,US,2020-09-13,,,,,,,Millions for Prisoners New Mexico,for closure of immigrant detention camps,1,rally,,,,,1,1,https://rallylist.com/wp-content/uploads/2020/09/Set-Them-Free-Sunday-840x385.jpg,,,,,
Henderson,"Xtreme Manufacturing, 8350 Eastgate Rd",,NV,US,2020-09-13,"about 25,000",25000,,25000,,,general protesters,for President Trump,2,rally,,,,,1,1,https://www.cnn.com/2020/09/13/politics/trump-indoor-rally-coronavirus-2020/index.html,https://www.reuters.com/article/us-usa-election-trump-rally/trump-holds-campaign-rally-indoors-despite-coronavirus-concerns-idUSKBN264109,https://heavy.com/news/2020/09/trump-nevada-rally-crowd-photos-henderson-las-vegas/,,,
Henderson,"Xtreme Manufacturing, 8350 Eastgate Rd",,NV,US,2020-09-13,,,,,,,general protesters,"against racism, against police violence",1,counter-protest,,,,,0,1,https://twitter.com/EmmaGoldmanSOS/status/1305370956232183809,,,Small group disrupted Trump rally to call for justice for Jorge Gomez who was killed by LVPD after attending a protest.,,
Inglewood,SoFi Stadium,,CA,US,2020-09-13,,,,,,,football players,"against racism, against police violence",1,protest,,,,,1,1,https://www.sportingnews.com/us/nfl/news/nfl-player-protests-national-anthem/j2ewh9cume8z1ktdv4um6druk,,,,,
Inverness,Tomales Point Elk Preserve,,CA,US,2020-09-13,about 60,60,,60,,,forELK,"against enclosure of elk, for better animal management",0,protest,,,,,1,1,https://www.marinij.com/2020/09/14/environmental-groups-protest-point-reyes-elk-management-on-anniversary/,,,,,
Ithaca,Ithaca Commons,,NY,US,2020-09-13,,,,,,,general protesters,"against racism, against police violence, for defunding police",1,rally; march,,,,,1,1,https://ithacavoice.com/2020/09/weekly-rally-centers-on-calls-for-movement-unity/,,,"Truth & Justice rally; article notes that these started ""months ago"" and have continued weekly ever since.",,
Jackson,Town Square,,WY,US,2020-09-13,,,,,,,general protesters,for police,2,rally,,,,,1,1,https://buckrail.com/pro-cop-rally-hits-jackson-town-square/,,,,,
Jacksonville,TIAA Bank Field,,FL,US,2020-09-13,,,,,,,football players,"against racism, against police violence",1,protest,,,,,1,1,https://www.sportingnews.com/us/nfl/news/nfl-player-protests-national-anthem/j2ewh9cume8z1ktdv4um6druk,,,,,
Johnson City,Founders Park to West State of Franklin,,TN,US,2020-09-13,several dozen,36,,36,,,general protesters,"against racism, against police violence",1,march,,,,,1,1,https://www.johnsoncitypress.com/news/local-news/demonstrators-take-to-streets-after-black-lives-matter-supporter-run-over-during-saturday-march/article_1f205be0-f61f-11ea-84d7-0f085aac4b93.html,,,,,
Johnson City,,,TN,US,2020-09-13,several,3,,3,,,general protesters,"against Black Lives Matter, for police",2,counter-protest,,,,,0,1,https://www.johnsoncitypress.com/news/local-news/demonstrators-take-to-streets-after-black-lives-matter-supporter-run-over-during-saturday-march/article_1f205be0-f61f-11ea-84d7-0f085aac4b93.html,,,,,
Kings Mountain,"Patriot Park, 400 S Railroad Ave",,NC,US,2020-09-13,,,,,,,general protesters,"against pedophelia, against child sex trafficking, #SaveOurChildren",0,march,,,,,1,1,https://www.facebook.com/events/249413346141131/,,,,,
Lancaster,"Lancaster City Police Bureau, 39 W Chestnut St",,PA,US,2020-09-13,hundreds,200,,200,,,general protesters,against police violence,1,protest,8,,,1,1,1,https://www.foxnews.com/us/protests-emerge-in-lancaster-after-fatal-shooting-of-man-armed-with-knife-da,https://twitter.com/CarterLNP/status/1305308740510457859,https://www.washingtonpost.com/nation/2020/09/14/lancaster-shooting-ricardo-munoz/?hpid=hp_hp-more-top-stories_650p-mon-lancaster%3Ahomepage%2Fstory-ans,,1,
Landover,FedEx Field,,MD,US,2020-09-13,,,,,,,football players,"against racism, against police violence",1,protest,,,,,1,1,https://www.sportingnews.com/us/nfl/news/nfl-player-protests-national-anthem/j2ewh9cume8z1ktdv4um6druk,,,,,
Lawrenceburg,Perfect North Slopes,,IN,US,2020-09-13,,,,,,,Patriots for America,for President Trump,2,rally; car caravan,,,,,1,1,https://www.fox19.com/2020/09/04/rolling-rally-president-trump-expected-start-sunday-indiana/,,,"Let's Roll to Re-Elect Trump! Starts in Indiana, route goes through Ohio, including Cincinnati.",,
Los Gatos,Town Plaza,,CA,US,2020-09-13,,,,,,,general protesters,antiracism; against police brutality,1,protest,,,,,1,1,https://www.instagram.com/p/CE2ETgeh3cI/,,,,,
Madison,River Boat Inn,,IN,US,2020-09-13,,,,,,,Sons & Daughters of Liberty,"for President Trump, for police",2,rally,,,,,1,1,https://rallylist.com/wp-content/uploads/2020/09/Pro-Trump-840x385.jpg,,,,,
Madison,McPike Park,,WI,US,2020-09-13,,,,,,,Allied for Black Lives - Madison; WORT FM; Mickey's Tavern; GSAFE,"against racism, against police brutality",1,march,,,,,1,1,https://www.facebook.com/events/298720928101976/,https://twitter.com/MikiTakesPhotos/status/1305258756972908544?s=03,,Kids March for Black Lives,,
Malden,600 Summer St,,MA,US,2020-09-13,,,,,,,City Life/Vida Urbana,for eviction moratorium during COVID-19 pandemic,0,rally,,,,,1,1,https://www.facebook.com/events/2745332582367506/,,,,,
Milwaukee,North Point Water Tower,,WI,US,2020-09-13,,,,,,,general protesters,"against racism, against police violence",1,march,,,,,1,1,https://www.facebook.com/events/982717242150474/,,,,,
Minneapolis,U.S. Bank Stadium,,MN,US,2020-09-13,,,,,,,football players,"against racism, against police violence",1,protest,,,,,1,1,https://www.sportingnews.com/us/nfl/news/nfl-player-protests-national-anthem/j2ewh9cume8z1ktdv4um6druk,,,,,
New York,The Plaza,,NY,US,2020-09-13,,,,,,,New York Voices for a Better NYC,"against Mayor Bill DeBlasio, for law and order, for reopening indoor dining during COVID-19 pandemic, #DEBLASIOmustGO, #FireBDBnyc",0,rally; march,,,,,1,1,https://www.facebook.com/events/627809434545160/,,,United New Yorkers Rally,,
New York,The Lucerne to Gracie Mansion,,NY,US,2020-09-13,,,,,,,general protesters,for housing for homeless people during the COVID-19 pandemic,0,protest,,,,,0,1,https://newyork.cbslocal.com/2020/09/13/homeless-new-york-city-homeless-hotels-lucerne-hotel-coronavirus-covid-19-gracie-mansion-carl-schurz-park/,,,,,
Oakland,Courthouse on 12th St to Pillars at Lake Merritt,,CA,US,2020-09-13,,,,,,,local Latinx and indigenous people ,pro justice and peace,1,protest,,,,,1,1,https://www.instagram.com/p/CE2EpyYBLct/,,,,,
Oakland,Frank Ogawa Plaza,,CA,US,2020-09-13,,,,,,,local Buddhists,antiracism; Black Lives Matter,1,"rally, meditation",,,,,0,1,https://sf.funcheap.com/sit-walk-listen-black-lives-matter-3/,,,,,
Oakland,City Hall,,CA,US,2020-09-13,,,,,,,Bay Area Workers Support; Hacking/Hustling; Fight for the Future,oppose EARN IT Act,1,rally,,,,,0,1,https://sf.funcheap.com/sex-workers-peaceful-action-earn-act/,,,,,
Orchard Park,Bills Stadium,,NY,US,2020-09-13,,,,,,,football players,"against racism, against police violence",1,protest,,,,,1,1,https://www.sportingnews.com/us/nfl/news/nfl-player-protests-national-anthem/j2ewh9cume8z1ktdv4um6druk,,,,,
Peoria,Peoria City Hall,,IL,US,2020-09-13,,,,,,,Queer Activist Collective; Peoria Mutual Aid Network; Black Lives Matter Central Illinois; Black Justice Project; Peoria Proud,"against racism, for transgender persons' rights",1,march,,,,,1,1,https://www.facebook.com/events/1178470359190667/,,,,,
Rochester,Rochester Tech Park,,NY,US,2020-09-13,,,,,,,general protesters,"for police, Back the Blue",2,motorcycle ride,,,,,1,1,https://www.democratandchronicle.com/story/news/2020/09/12/rallies-racial-justice-rochester-monroe-county-daniel-prude-lysenko-cuomo-penfield/5779612002/,,,,,
Rochester,Martin Luther King Jr. Memorial Park,,NY,US,2020-09-13,,,,,,,general protesters,"against racism, against police violence, for resignation of county district attorney",1,march,,,,,0,1,https://spectrumlocalnews.com/nys/rochester/public-safety/2020/09/14/sunday-night-daniel-prude-protests-in-rochester,https://twitter.com/PBoudreauxNews/status/1305303533034635264,,,,
Saint Charles,St. Charles Police Department and Municipal Court,,MO,US,2020-09-13,roughly 50-75 protesters,50,,75,,,Expect Us,"against racism, against police violence",1,march,several,,,,1,1,http://www.stlamerican.com/news/local_news/black-lives-matter-vs-let-us-play-a-tale-of-two-protest-movements/article_c71282c4-fb9c-11ea-9d41-3718d6680740.html,,,,,
Santa Clara,Levi's Stadium,,CA,US,2020-09-13,,,,,,,football players,"against racism, against police violence",1,protest,,,,,1,1,https://www.sportingnews.com/us/nfl/news/nfl-player-protests-national-anthem/j2ewh9cume8z1ktdv4um6druk,,,,,
San Francisco,SF Public Library,,CA,US,2020-09-13,,,,,,,Every28 Foundation,antiracism; against police brutality,1,protest,,,,,1,1,https://sf.funcheap.com/yo-hood-peaceful-protest-march-blm/,,,,,
Seattle,Green Lake Park,,WA,US,2020-09-13,,,,,,,general protesters,"against racism, against police brutality",1,rally; march,,,,,1,1,https://www.facebook.com/events/312674009827166/,,,,,
Tulsa,River Parks,,OK,US,2020-09-13,,,,,,,general protesters,"against racism, against police brutality",1,march,,,,,1,1,https://www.facebook.com/events/667523557217893/,,,,,
Vacaville,Andrew's Park,,CA,US,2020-09-13,,,,,,,@voicesofvv,antiracism; against police brutality,1,protest,,,,,1,1,https://www.instagram.com/p/CE932zKhlWF/,,,,,
Westminster,,,CO,US,2020-09-13,around 100; around 500,100,,500,,,general protesters,"against racism, against police violence",1,protest,,,,,1,1,https://www.denverpost.com/2020/09/13/black-lives-matter-protest-westminster-sunday/,,,,,
Westminster,,,CO,US,2020-09-13,handful,5,,5,,,general protesters,against Black Lives Matter,2,counter-protest,,,,,0,1,https://www.denverpost.com/2020/09/13/black-lives-matter-protest-westminster-sunday/,,,,,
Ann Arbor,"The Diag, University of Michigan",,MI,US,2020-09-14,,,,,,,Graduate Employees' Organization,for better workplace protections for student employees during COVID-19 pandemic,0,strike; picket,,,,,1,1,https://www.michigandaily.com/section/academics/graduate-students-vote-extend-strike-until-friday,,,,,
Baltimore,Baltimore City Hall,,MD,US,2020-09-14,about 30 people,30,,30,,,general protesters,against privatization of public housing,0,protest,,,,,1,1,https://www.baltimoresun.com/maryland/baltimore-city/bs-md-ci-protest-housing-20200914-hllribceevcipo6euhrntmvxpe-story.html,,,,,
Barrington,Citizen's Park,,IL,US,2020-09-14,hundreds,200,,200,,,students; parents,for allowing in-person schooling and fall contact sports during COVID-19 pandemic,0,rally,,,,,1,1,https://wgntv.com/news/coronavirus/suburban-high-school-students-and-parents-hold-rally-for-in-person-learning-athletics/,https://www.nbcchicago.com/news/local/parents-and-students-call-for-return-to-school-and-sports-in-barrington/2338945/,,,,
Buffalo,Niagara Square,,NY,US,2020-09-14,count video,30,,50,,,general protesters,"against racism, against police violence, for defunding police",1,rally,,,,,1,1,https://spectrumlocalnews.com/nys/buffalo/news/2020/09/15/protest-at-niagara-square,,,,,
Charleston,West Virginia State Capitol,,WV,US,2020-09-14,hundreds,200,,200,,,students; parents; coaches,against online schooling during COVID-19 pandemic,0,protest,,,,,1,1,https://wchstv.com/news/local/hundreds-of-students-coaches-parents-protest-against-school-closings-at-wvacapitol,https://www.wsaz.com/2020/09/14/west-virginias-color-coded-metrics-under-fire-at-rally/,,,,
Chicago,University of Illinois Hospital,,IL,US,2020-09-14,hundreds,200,,200,,,Illinois Nurses Association,"for better pay and workplace conditions for nurses at the UIC hospital, against outsourcing hospital jobs",0,strike; picket,,,,,1,1,https://news.wttw.com/2020/09/12/uic-nurses-launch-7-day-strike-seiu-workers-join-forces-monday,https://www.beckershospitalreview.com/hr/nurses-strike-in-third-day-at-university-of-illinois-hospital-second-uic-strike-begins.html,https://www.nbcchicago.com/news/local/healthcare-workers-join-uic-nurses-on-picket-line-during-strike/2338530/,,,
Chicago,University of Illinois at Chicago,,IL,US,2020-09-14,,,,,,,SEIU Local 73,for better pay and workplace protections during the COVID-19 pandemic,0,strike; picket,,,,,0,1,https://www.beckershospitalreview.com/hr/nurses-strike-in-third-day-at-university-of-illinois-hospital-second-uic-strike-begins.html,https://twitter.com/SEIU73/status/1305545274434228226,http://www.fightbacknews.org/2020/9/15/5300-uic-workers-strike-our-lives,https://workdayminnesota.org/healthcare-workers-are-leading-the-largest-strike-ever-at-the-university-of-illinois-chicago/,,
Clayton,"County Administration Building, 41 South Central",St. Louis,MO,US,2020-09-14,around 100,100,,100,,,student athletes; parents ,against postponing high school football season to spring due to COVID-19 pandemic,0,protest,,,,,1,1,https://www.kmov.com/news/students-parents-protest-youth-sports-restrictions-for-second-day/article_257bce6c-f6d7-11ea-ac2d-d341ea536989.html,https://www.stltoday.com/lifestyles/health-med-fit/coronavirus/youth-sports-advocates-rally-again-outside-st-louis-county-government-building/article_777a1bb2-081d-5f64-82eb-7cf613271636.html,,,,
Cleveland,801 W Superior Ave,,OH,US,2020-09-14,dozens,24,,24,,,Association of Flight Attendants,for passage of federal economic relief package due to COVID-19 pandemic,0,rally,,,,,1,1,https://www.news5cleveland.com/news/local-news/cleveland-metro/12-30-pm-local-flight-attendants-hold-rally-to-demand-senate-pass-covid-19-relief-package,,,,,
College Station,Texas A&M University,,TX,US,2020-09-14,dozens,24,,24,,,graduate students,for better workplace protections and hazard pay for student employees during COVID-19 pandemic,0,march,,,,,1,1,https://theeagle.com/news/a_m/texas-a-m-graduate-workers-protest-working-conditions/article_8d174bb8-f6ec-11ea-bb3b-a39f6ab0153f.html,,,,,
Columbia,Irmo High School,,SC,US,2020-09-14,about 100,100,,100,,,parents,against online schooling during COVID-19 pandemic,0,protest,,,,,1,1,https://www.wistv.com/2020/09/14/lexington-richland-parents-protest-day-in-person-learning/,,,,,
Denver,Mile High Stadium,,CO,US,2020-09-14,,,,,,,football players,"against racism, against police violence",1,protest,,,,,1,1,https://gazette.com/sports/broncos-titans-players-take-knee-in-peaceful-protest-during-singing-of-national-anthem/article_f83f4b1c-f6fa-11ea-9787-4383602403d3.html,,,,,
Detroit,University of Michigan Detroit Center,,MI,US,2020-09-14,,,,,,,Graduate Employees' Organization,for better workplace protections for student employees during COVID-19 pandemic,0,protest,,,,,1,1,https://www.michigandaily.com/section/academics/graduate-students-vote-extend-strike-until-friday,,,,,
East Amherst,Williamsville CSD District Office,,NY,US,2020-09-14,,,,,,,general protesters,against online schooling during COVID-19 pandemic,0,protest,,,,,1,1,https://www.wivb.com/news/parents-and-students-protest-as-williamsville-csd-says-goodbye-to-teachers-recently-hired/,,,,,
Eau Claire,Eau Claire City-County Health Department,,WI,US,2020-09-14,nearly 100,100,,100,,,general protesters,against mandated health practices during COVID-19 pandemic,0,protest,,,,,1,1,https://wqow.com/2020/09/14/nearly-100-residents-protest-new-potential-health-ordinance/,,,,,
Grand Island,Central District Health Department,,NE,US,2020-09-14,,,,,,,parents,against mask mandate for students during COVID-19 pandemic,0,protest,,,,,1,1,https://nebraska.tv/news/local/parent-lead-protest-at-the-central-district-health-department,,,,,
Harrisburg,"Harrisburg School District Offices, 1601 State St",,PA,US,2020-09-14,,,,,,,high school athletes,against cancellation of fall high school sports season due to COVID-19 pandemic,0,rally,,,,,1,1,https://www.abc27.com/sports/local-sports/harrisburg-high-athletes-rally-against-decision-to-cancel-fall-sports/,,,,,
Jonesborough,Washington County Board of Education,,TN,US,2020-09-14,count pic,7,,7,,,parents,against online schooling during COVID-19 pandemic,0,protest,,,,,1,1,https://www.wjhl.com/covid-19-keeping-schools-safe/parents-protest-for-school-to-return-to-normal-next-week-boe-keeps-hybrid-model/,,,,,
Kenosha,Kenosha County Courthouse,,WI,US,2020-09-14,"About 40 to 50 occupied the steps in front of the courthouse, while a few dozen spilled into the street",75,,100,,,general protesters,"against racism, against police violence",1,protest,,,,,1,1,https://www.lakegenevanews.net/news/local/protests-return-to-kenosha-county-after-womans-traffic-arrest/article_9444ef18-3f79-506d-b161-5e82712e5452.html,,,Police in riot gear lined the platform in front of the building.,,
Lancaster,Prince St and Chestnut St,,PA,US,2020-09-14,around 100,100,,100,,,general protesters,"against racism, against police violence, for reforming police, for defunding police, for abolishing police",1,protest,,,,,1,1,https://www.pennlive.com/news/2020/09/second-night-of-lancaster-protests-sees-smaller-more-peaceful-crowd.html,,,,,
New York,"PS 139, Brooklyn",,NY,US,2020-09-14,,,,,,,general protesters,for better workplace protections for teachers and students in NYC schools during COVID-19 pandemic,0,rally; work-out,,,,,1,1,https://gothamist.com/news/nyc-teachers-stage-work-out-saying-schools-are-not-safe-enter,https://www.brooklynpaper.com/ditmas-park-school-covid-19/,https://twitter.com/protest_nyc/status/1305546069112238080,,,
New York,The Earth School,,NY,US,2020-09-14,,,,,,,general protesters,for better workplace protections for teachers and students in NYC schools during COVID-19 pandemic,0,rally; work-out,,,,,0,1,https://twitter.com/protest_nyc/status/1305546070093713410,,,,,
New York,Grace Dodge High School,,NY,US,2020-09-14,,,,,,,general protesters,for better workplace protections for teachers and students in NYC schools during COVID-19 pandemic,0,rally; work-out,,,,,0,1,https://twitter.com/protest_nyc/status/1305546071075164160,,,,,
New York,Urban Assembly Makers Academy,,NY,US,2020-09-14,,,,,,,general protesters,for better workplace protections for teachers and students in NYC schools during COVID-19 pandemic,0,rally; work-out,,,,,0,1,https://twitter.com/protest_nyc/status/1305546073331634176,,,,,
New York,New York City Hall,,NY,US,2020-09-14,,,,,,,Fox Lifestyle Hospitality,for relaxation of COVID-related restrictions on restaurants in New York City,0,march,,,,,0,1,https://gritdaily.com/nyc-restaurant-owners-and-staff-march-to-demand-gov-cuomo-ease-dining-rules-ahead-of-winter/,,,,,
Pawleys Island,,,SC,US,2020-09-14,dozens,24,,24,,,Georgetown NAACP,"against racism, for resignation of mayor",1,protest,,,,,1,1,https://wpde.com/news/local/georgetown-naacp-announces-plan-to-protest-until-mayor-resigns,,,,,
Plainfield,"Plainfield School District 202 headquarters, Lincoln Hwy",,IL,US,2020-09-14,count pic,15,,25,,,students; parents,for in-person schooling during COVID-19 pandemic,0,demonstration,,,,,1,1,https://patch.com/illinois/plainfield/plainfield-parents-students-rally-person-classes,,,,,
Richmond,Virginia State Capitol,,VA,US,2020-09-14,,,,,,,students; parents,against decision to postpone fall high school sports season due to COVID-19 pandemic,0,protest,,,,,1,1,https://www.wric.com/sports/local-sports/parents-students-hold-let-them-play-rally-asking-for-return-to-high-school-sports/,,,,,
Ridgewood,,,NJ,US,2020-09-14,nearly 200,200,,200,,,general protesters,against resignation of superintendent of schools Daniel Fishbein,0,rally,,,,,1,1,https://www.northjersey.com/story/news/bergen/ridgewood/2020/09/14/ridgewood-nj-rallies-behind-outgoing-school-superintendent/5799891002/,,,,,
Rochester,Jefferson Ave,,NY,US,2020-09-14,count video,75,,150,,,general protesters,"against racism, against police violence, for resignation of mayor",1,rally,,,,,1,1,https://www.democratandchronicle.com/story/news/2020/09/14/rochester-protest-daniel-prude-death-lovely-warren-ousted-chief-singletary/5799770002/,https://13wham.com/news/local/protesters-increase-calls-for-warrens-resignation,,,,
Sacramento,McClellan Park,,CA,US,2020-09-14,,,,,,,general protesters,against President Trump,1,protest,,,,,1,1,https://abc7news.com/protesters-in-sacramento-chp-trump-protest-today/6423342/,https://www.instagram.com/p/CFGR1xThgax/,,A police car struck a protester.,,
Sacramento,Ruth Inman Park,,CA,US,2020-09-14,,,,,,,general protesters,against President Trump,1,protest,,,,,0,1,https://www.instagram.com/p/CFGR1xThgax/,,,,,
Sharon,Sharon Town Hall,,MA,US,2020-09-14,count video,100,,200,,,teachers,for better workplace protections for teachers during COVID-19 pandemic,0,rally,,,,,1,1,https://www.wcvb.com/article/sharon-teachers-who-say-school-buildings-unsafe-to-hold-rally/34009006,,,,,
Shiprock,Shiprock Chapter House to Shiprock Police Department,,NM,US,2020-09-14,about two dozen,24,,24,,,general protesters,against local hemp farm,0,march,,,,1,1,1,https://navajotimes.com/reznews/hemp-opponents-launch-another-protest/,https://navajotimes.com/reznews/hemp-hoop-house-nearly-destroyed-by-fire/,,,,
Stillwater,"Stillwater Board of Education, 314 S Lewis St",,OK,US,2020-09-14,dozens,24,,24,,,students,against cancellation of school athletic events due to COVID-19 pandemic,0,protest,,,,,1,1,https://www.stwnewspress.com/covid-19/breaking-protest-forms-outside-sps-administration-building-after-sports-cancellation/article_ff9ac494-f6c9-11ea-af7e-9f036b073b7b.html,,,,,
Albany,Albany City Hall,,NY,US,2020-09-15,,,,,,,Citizen Action of NY; The NYS Capital District Poor People's Campaign; VOCAL-NY; United Tenants of Albany; Labor Religion Coalition of New York State,"for changes to housing policy in New York, for protections against eviction during the COVID-19 pandemic",0,protest,,,,,1,1,https://www.news10.com/news/albany-county/activists-to-rally-at-city-hall-in-support-of-housing-policy-updates/,,,,,
Albuquerque,North Domingo Baca Park,,NM,US,2020-09-15,about half a dozen people,6,,6,,,general protesters,against state mask mandate during COVID-19 pandemic,0,protest,,,,,1,1,https://www.koat.com/article/small-group-holds-a-no-mask-protest-in-albuquerque/34033374,,,,,
Anchorage,Loussac Public Library,,AK,US,2020-09-15,two dozen,24,,24,,,general protesters,against COVID-19 emergency order barring dancing and loud music,0,protest,,,,,1,1,https://mustreadalaska.com/dance-party-protest-goes-footloose-on-mayors-ban-on-dancing-and-loud-music/,https://www.adn.com/alaska-news/anchorage/2020/09/15/dancers-protest-anchorage-covid-19-emergency-order/,,,,
Baltimore,Harriet Tubman Grove,,MD,US,2020-09-15,about 20,20,,20,,,Coalition for a Humane Hopkins,against university's practice of suing hospital patients over medical debt,0,protest,,,,,1,1,https://www.jhunewsletter.com/article/2020/09/protesters-demand-end-to-universitys-medical-debt-lawsuits,,,,,
Boston,Government Center,,MA,US,2020-09-15,roughly 75 people,75,,75,,,general protesters,against court ruling allowing elimination of Temporary Protected Status program for immigrants,1,protest,,,,,1,1,https://www.thecrimson.com/article/2020/9/16/harvard-affiliates-tps-protest/,,,,,
Brentwood,Brentwood City Park,,CA,US,2020-09-15,,,,,,,parents; students,for in-person schooling during COVID-19 pandemic,0,rally,,,,,1,1,https://www.eastbaytimes.com/2020/09/15/parents-others-will-rally-to-demand-schools-be-opened/,,,,,
Buffalo,Erie County Hall,,NY,US,2020-09-15,count video,40,,60,,,general protesters,"for resignation of mayor, for resignation of police commissioner, for resignation of district attorney, against police violence, against racism",1,protest,,,,,1,1,https://www.radio.com/wben/news/protesters-call-on-erie-county-da-john-flynn-to-resign,https://www.wgrz.com/article/news/local/protesters-write-resign-outside-erie-county-district-attorneys-office/71-f684f0e5-a7a6-4255-b253-9d4d5aeff463,,,,
