CityTown,Location,County,StateTerritory,Country,Date,EstimateText,EstimateLow,BestGuess,EstimateHigh,AdjustedLow,AdjustedHigh,Actor,Claim,Pro(2)/Anti(1),EventType,ReportedArrests,ReportedParticipantInjuries,ReportedPoliceInjuries,ReportedPropertyDamage,TownsCities,Events,Source1,Source2,Source3,Misc.,TearGas,
Burlington,Battery Park,,VT,US,2020-09-01,"more than 500; more than 1,000",500,,1000,,,general protesters,"against racism, against police violence, for police reform",1,encampment; march,,,,,1,1,https://www.wcax.com/2020/09/02/burlington-protests-continue-police-say-demands-wont-be-met/,https://vtdigger.org/2020/09/10/protesters-say-they-wont-give-in-can-burlington-remove-these-cops/,,,,
Dallas,Spring Valley Rd,,TX,US,2020-09-01,,10,,10,,,general protesters,for eviction moratorium during COVID-19 pandemic,1,demonstration,,,,,1,1,https://www.dallasobserver.com/news/dallas-demonstration-for-more-help-for-unemployed-draws-tiny-group-11939637,,,,,
El Cerrito,El Cerrito Plaza BART,,CA,US,2020-09-01,,,,,,,general protestors,antiracism; against police brutality,1,caravan,,,,,1,1,https://sf.funcheap.com/justice-peace-caravan-support-black-lives-matter-2/,,,,,
Kenosha,40th St and 28th Ave,,WI,US,2020-09-01,,,,,,,general protesters,"against racism, against police violence",1,community gathering,,,,,1,1,https://twitter.com/FightFor15WI/status/1300840900441104384,,,#JusticeForJacob,,
Kenosha,City of Kenosha Municipal Building,,WI,US,2020-09-01,,,,,,,Refuse Fascism Chicago; Degenerate Artists Against Fascism; #NoMore; Black Lives Matter Lake County Illinois,"for resignation of President Trump, against fascism, against racism, against police violence",1,protest,,,,,0,1,https://www.facebook.com/events/936438776864639/,,,,,
Leesburg,Loudon County Government Center,Loudon,VA,US,2020-09-01,roughly 100,100,,100,,,Virginia Constitutional Conservatives,for gun rights,2,rally,,,,,1,1,https://www.facebook.com/events/932800373907418/,https://www.loudountimes.com/news/loudoun-county-supervisors-advance-local-regulations-related-to-firearms/article_5119af6e-ed2f-11ea-82d0-774661d56531.html,,,,
New York,Brooklyn,,NY,US,2020-09-01,count pic,15,,,,,teachers; parents; children,against reopening public schools during COVID-19 pandemic,1,protest,,,,,1,1,https://gothamist.com/news/teachers-will-ask-judge-block-person-learning-nyc-public-schools,,,,,
Portland,Alberta Park,,OR,US,2020-09-01,,,,,,,general protesters,"against racism, against police violence",1,protest,,,,,1,1,https://www.kgw.com/article/news/local/protests/protesters-to-march-from-woodstock-park/283-c238e2ac-789d-473a-aa47-eade498333ac,,,Crowd met but decided not to march due to small numbers.,,
San Francisco,,,CA,US,2020-09-01,,,,,,,Resistance SF,Medicare for all; UBI; cancel rent; safe housing; living wage; equal education; racial justice,1,strike,,,,,1,1,https://www.instagram.com/p/CEYE01tBFWF/,,,,,
San Jose,San Jose State University,,CA,US,2020-09-01,,,,,,,football players,antiracism; against police brutality,1,protest,,,,,1,1,https://www.instagram.com/p/CElC5frhvbZ/,,,,,
Burlington,Battery Park,,VT,US,2020-09-02,,,,,,,general protesters,"against racism, against police violence",1,encampment; march,,,,,1,1,https://www.wcax.com/2020/09/09/burlington-city-council-holds-emergency-meeting-to-hear-from-protesters/,,,,,
Coeur d'Alene,Ramsey Softball Fields,,ID,US,2020-09-02,,,,,,,general protesters,"against child sex trafficking, #SaveOurChildren",0,rally,,,,,1,1,https://allevents.in/coeur%20d%20alene/saveourchildren-rally/200020038313530,,,,,
Dubuque,Allison Henderson Park,,IA,US,2020-09-02,count: FB,72,,72,,,Switching Places Foundation,"against racism, against police violence",1,rally,,,,,1,1,https://www.facebook.com/events/916755522068019/,,,,,
New York,"Myrtle Ave, Fort Greene",,NY,US,2020-09-02,,,,,,,Gangsta's Making Astronomical Community Changes,against gun violence,1,rally,,,,,1,1,https://www.brooklynpaper.com/142347-2/,,,,,
Pittsburgh,Sixth St,,PA,US,2020-09-02,about 20,20,,20,,,Allegheny County employees and allies,"against workplace dresscode barring political or social protest messages, against racism",1,protest,,,,,1,1,https://www.pghcitypaper.com/pittsburgh/port-authority-workers-protest-against-anti-social-justice-dress-code-prohibiting-black-lives-matter-masks/Content?oid=17926182,,,,,
Portland,Woodstock Park,,OR,US,2020-09-02,around 100,100,,100,,,general protesters,"against racism, against police violence",1,march,3,,,,1,1,https://www.kgw.com/article/news/local/protests/protesters-to-march-from-woodstock-park/283-c238e2ac-789d-473a-aa47-eade498333ac,,,,,
Richmond,Science Museum of Virginia,,VA,US,2020-09-02,dozens,24,,24,,,Virginia Freedom Keepers,"against COVID-related medical mandates, against vaccine mandate",2,march,,,,,1,1,https://www.wric.com/news/local-news/richmond/dozens-march-against-vaccine-mandates-in-richmond/,https://www.eventbrite.com/e/march-against-mandates-tickets-118576472421,,,,
Rochester,Public Safety Building,,NY,US,2020-09-02,count video,50,,100,,,general protesters,"against racism, against police violence, for abolishing police unions",1,protest,9,,,,1,1,https://www.rochesterfirst.com/news/local-news/watch-live-protest-at-public-safety-building-in-rochester-sparks-after-news-of-daniel-prudes-death/,https://13wham.com/news/local/demonstrators-descend-on-corner-where-daniel-prude-was-restrained-by-rpd,https://www.rochesterfirst.com/news/local-news/protesters-arrested-in-downtown-rochester-after-activists-barred-from-mayors-press-conference/,"In response to release of bodycam footage showing death of Daniel Prude in police custody in March 2020, when he suffocated after police placed a hood over his head. See also https://www.youtube.com/watch?v=9_-VcV-UJj4",,
Saint Paul,Minnesota Bureau of Criminal Apprehension,,MN,US,2020-09-02,,,,,,,general protesters,"against racism, against police violence, for criminal justice reform",1,protest,,,,,1,1,https://unicornriot.ninja/2020/two-years-later-protest-at-mn-bca-seeks-justice-for-hardel-sherrell/,https://twitter.com/UR_Ninja/status/1301258203208900609,,,,
Washington,Washington Metropolitan Police Department 7th District,,DC,US,2020-09-02,around 100 ,100,,100,,,general protesters,"against racism, against police violence",1,protest,,,,,1,1,https://www.washingtonpost.com/local/public-safety/dc-police-officer-shoots-wounds-person-in-southeast-washington/2020/09/02/100ec8ac-ed5b-11ea-99a1-71343d03bc29_story.html,https://twitter.com/FordFischer/status/1301546775208169476,,Response to fatal shooting of Deon Kay by police earlier in the day. Police used bicycles as barriers to herd protesters away from station.,,
Burlington,Battery Park,,VT,US,2020-09-03,several hundred,300,,300,,,general protesters,"against racism, against police violence",1,encampment; march,,,,,1,1,https://www.wcax.com/2020/09/09/burlington-city-council-holds-emergency-meeting-to-hear-from-protesters/,https://vtdigger.org/2020/09/10/protesters-say-they-wont-give-in-can-burlington-remove-these-cops/,,,,
Gulfport,Harrison County Courthouse,,MS,US,2020-09-03,count video,10,,15,,,general protesters,"for removal of Confederate statue, against racism",1,protest,,,,,1,1,https://www.wlox.com/2020/09/03/group-protests-removal-confederate-statue-harrison-county-courthouse/,https://twitter.com/HughKeeton/status/1301660604709601285,,,,
Gulfport,Harrison County Courthouse,,MS,US,2020-09-03,count video,5,,10,,,Southern Defense Force,against removal of Confederate statue,2,counter-protest,,,,,1,1,https://www.wlox.com/2020/09/03/group-protests-removal-confederate-statue-harrison-county-courthouse/,https://twitter.com/HughKeeton/status/1301660604709601285,,,,
Little Rock,Arkansas State Capitol,,AR,US,2020-09-03,,,,,,,Conduit for Action,"against COVID-related mandates, against Governor Hutchinson",2,rally,,,,,1,1,https://conduitnews.com/2020/08/lawsuit-against-hutchinson-administrations-covid-19-edicts/,,,,,
New York,Times Square,,NY,US,2020-09-03,,,,,,,general protesters,"against racism, against police violence",1,march,,several,,,1,1,https://www.pix11.com/news/local-news/manhattan/video-shows-car-driving-into-daniel-prude-protesters-in-times-square,https://gothamist.com/news/video-pro-trump-counterprotesters-received-nypd-escort-driving-through-black-lives-matter-march,,Car drove into crowd of marchers. No one injured. Conjecture about whether driver came from nearby pro-Trump protest.,,
New York,Duffy Square,,NY,US,2020-09-03,,,,,,,general protesters,for President Trump,2,counter-protest,,,,,0,1,https://www.pix11.com/news/local-news/manhattan/video-shows-car-driving-into-daniel-prude-protesters-in-times-square,https://gothamist.com/news/video-pro-trump-counterprotesters-received-nypd-escort-driving-through-black-lives-matter-march,,,,
Newburyport,Clipper City Rail Trail,,MA,US,2020-09-03,count: FB,14,,14,,,general protesters,"against racism, against police violence",1,march,,,,,1,1,https://www.facebook.com/events/309611397038665/,,,,,
Pawtucket,Pawtucket City Hall,,RI,US,2020-09-03,count pic,10,,,,,Black Lives Matter Rhode Island,"against racism, against police violence, against qualified immunity",1,protest,,,,,1,1,https://turnto10.com/news/local/black-lives-matter-ri-holds-rally-against-good-ole-boy-network-in-pawtucket,https://www.facebook.com/events/2750726161869329/,,,,
Philadelphia,Philadelphia City Hall,,PA,US,2020-09-03,more than 60,60,,60,,,Philadelphia Tenants Union,"for eviction moratorium during COVID-19 pandemic, for canceling rent, against racism, against police brutality",1,protest; blockade,17,,,,1,1,https://www.inquirer.com/news/philadelphia/philadelphia-eviction-protest-arrests-court-philadelphia-tenants-union-20200903.html,,,"Protesters blocked entrances to municipal court. Dozens of police officers in tactical gear and on bicycles detained and cited 17, swept the area.",,
Rochester,Public Safety Building,,NY,US,2020-09-03,,,,,,,general protesters,"against racism, against police violence",1,protest,8,,2,,1,1,https://www.rochesterfirst.com/news/local-news/protest-underway-outside-public-safety-building-in-downtown-rochester/,https://twitter.com/zdroberts/status/1301724257349767169,,,1,
Saint Paul,Mears Park,,MN,US,2020-09-03,nearly 100,100,,100,,,Families Supporting Families Against Police Violence,"against racism, against police violence",1,march,,,,,1,1,https://unicornriot.ninja/2020/mom-leads-march-for-son-killed-by-police-in-1997/,,,Justice for Demetrius Hill,,
San Francisco,outside House Speaker Nancy Pelosi's home,,CA,US,2020-09-03,,,,,,,general protesters,against COVID-related business closures,2,protest,,,,,1,1,https://www.dailywire.com/news/angry-salon-customers-protest-at-pelosis-home-hang-blow-dryers-and-curlers-on-pelosis-tree/,,,"Protest by self-described ""angry salon customers"" who want to patronize salons and were mad about video showing Speaker Pelosi having her hair done at a salon.",,
San Francisco,Mission High,,CA,US,2020-09-03,,,,,,,general protesters,defund the police,1,protest,,,,,0,1,https://www.instagram.com/p/CEkZO4nhnjh/,,,,,
Tampa,2101 E 13th Ave,,FL,US,2020-09-03,about 20 vehicles,20,,20,,,Florida for $15,for higher minimum wage,1,strike; car caravan,,,,,1,1,https://www.cltampa.com/news-views/local-news/article/21143613/calling-for-a-living-wage-tampa-fast-food-workers-organized-a-car-caravan-and-walkout-strike,,,Outside McDonald's,,
Aurora,Aurora Police Department,,IL,US,2020-09-04,count: FB,31,,31,,,general protesters,"against pedophelia, against child sex trafficking",0,protest,,,,,1,1,https://www.facebook.com/events/744655809601347/,,,#SaveOurChildren,,
Burlington,University of Vermont Green,,VT,US,2020-09-04,,,,,,,general protesters,against police brutality,1,protest,,,,,1,1,https://www.wcax.com/2020/09/04/burlington-protesters-to-take-demands-to-mayors-doorstep/,,,Article notes that this was the 10th consecutive day of protests over this issue in Burlington.,,
Everett,3101 Broadway,,WA,US,2020-09-04,,,,,,,general protesters,"against racism, against police violence",1,march,2,,,,1,1,https://www.facebook.com/events/335733137627425/,https://www.heraldnet.com/news/everett-protest-ends-with-dramatic-encounter/,,"Car drove through protesters, no one injured",,
Everett,Broadway,,WA,US,2020-09-04,a few,3,,3,,,general protesters,"for police, Back the Blue",2,counter-protest,,,,,1,1,https://www.heraldnet.com/news/everett-protest-ends-with-dramatic-encounter/,,,,,
Kansas City,City Hall,,MO,US,2020-09-04,hundreds,200,,200,,,SCLC; NAACP; Urban League; UMLC Student Government Association; Black Rainbow,"against racism, against police brutality",1,march,,,,,1,1,https://www.kansascity.com/news/local/article245503560.html,https://www.thepitchkc.com/this-weeks-march-on-kansas-city-established-peaceful-protest-as-the-continuing-standard/,https://www.facebook.com/events/740363203466001/,,,
Kenosha,Wolfenbuttel Park,,WI,US,2020-09-04,,,,,,,general protesters,"against Black Lives Matter, for defense of Kyle Rittenberg, for gun rights",2,protest,,,,,1,1,https://www.rallylist.com/free-kyle-rittenhouse/,,,,,
La Crosse,University of La Crosse,,WI,US,2020-09-04,,,,,,,student workers,for hazard pay and better personal protective equipment during COVID-19 pandemic,0,strike ,,,,,1,1,https://twitter.com/oherken/status/1301957916778532865,,,,,
New York,Foley Square,,NY,US,2020-09-04,,150,,150,,,New Afrikan Black Panther Party; Revolutionary Abolitionist Movement,"against racism, against police violence, for abolishing police ",1,protest,8,,,1,1,1,https://nypost.com/2020/09/05/black-lives-matter-protesters-riot-in-manhattan-cause-100000-damage/,,,"Police claim protesters caused $100,000 in damage to storefronts.",,
New York,Brooklyn Friends School,,NY,US,2020-09-04,dozens,24,,24,,,teachers; parents; students,"against union-busting, for collective bargaining during COVID-19 pandemic",0,protest,,,,,1,1,https://www.brooklynpaper.com/brooklyn-friends-school-protest/,,,,,
Philadelphia,Philadelphia City Hall,,PA,US,2020-09-04,hundreds,200,,200,,,Party for Socialism and Liberation - Philadelphia,"against racism, against police violence, for defunding police, for justice for Jacob Blake, for stronger measures against COVID-19",1,rally; march,,,,,1,1,https://whyy.org/articles/protest-in-philly-over-police-shooting-of-jacob-blake-in-wisconsin/,https://www.facebook.com/events/308846963561346/,,,,
Poplar Bluff,Black River Coliseum,,MO,US,2020-09-04,count: FB,42,,42,,,general protesters,"against pedophelia, against child sex trafficking",0,protest,,,,,1,1,https://www.facebook.com/events/347824929953297/,,,,,
Portland,Portland Police Association,,OR,US,2020-09-04,a few hundred,300,,300,,,general protesters,"against racism, against police violence",1,protest,27,1,,,1,1,https://www.cbsnews.com/news/portland-protests-reach-100-consecutive-days-this-weekend/,https://www.washingtonpost.com/nation/2020/09/05/rochester-daniel-prude-protests/,,,1,
Providence,Burnside Park,,RI,US,2020-09-04,count: FB,14,,14,,,general protesters,"against racism, against police violence",1,protest; march,,,,,1,1,https://www.facebook.com/events/943662542805773/,,,,,
Rochester,Martin Luther King Jr. Park,,NY,US,2020-09-04,at least 1000,1000,,1000,,,general protesters,"against racism, against police violence, for resignation of mayor, for resignation of police chief",1,march,11,,3,1,1,1,https://www.washingtonpost.com/nation/2020/09/05/rochester-daniel-prude-protests/,https://twitter.com/zdroberts/status/1302080406326521858,https://twitter.com/ScooterCasterNY/status/1302060108898357257,"Police in riot gear used pepper balls, then tear gas after declaring unlawful assembly.",1,
Seattle,Ship Canal Bridge,,WA,US,2020-09-04,count video,20,,30,,,general protesters,"against racism, against police violence",1,roadblock,9,,,,1,1,https://www.king5.com/article/news/local/protests/troopers-arrest-9-drivers-for-blocking-sb-i-5-in-seattle/281-30a75539-beba-4134-867d-82b54ab2c5ec,https://twitter.com/gramsofgnats/status/1301935523267665920,,Protesters blocked I-5 with their cars. Police arrested 9 drivers and impounded 9 cars.,,
Arlington,,,VA,US,2020-09-05,more than 100,100,,100,,,general protesters,"against racism, against police violence",1,march,,,,,1,1,https://www.washingtonpost.com/local/protests-continue-saturday-in-dc-after-police-fatally-shoot-18-year-old-deon-kay-in-southeast/2020/09/05/f72a910e-eed6-11ea-ab4e-581edb849379_story.html,,,"Marched through Georgetown to Dupont Circle, met up with Occupy DC group there.",,
Atlanta,Auburn Ave and Jackson St,,GA,US,2020-09-05,,,,,,,Refuse Fascism ATL,"for resignation of President Trump, against fascism, against racism, against police violence",1,march; car caravan,,,,,1,1,https://www.facebook.com/events/927882117710821/,,,Trump/Pence Out Now,,
Austin,Texas State Capitol,,TX,US,2020-09-05,,,,,,,Refuse Fascism ATX,"for resignation of President Trump, against fascism, against racism, against police violence, for LGBTQ rights, for women's rights, for immigrants' rights, for First Amendment rights",1,protest,,,,,1,1,https://www.facebook.com/events/325738391950007/,,,Trump/Pence Out Now,,
Austin,Lake Travis,,TX,US,2020-09-05,,,,,,,general protesters,for President Trump,2,boat parade,,,,,0,1,https://cbsaustin.com/news/local/trump-boat-parade-planned-for-lake-travis-on-saturday,https://www.facebook.com/events/3308504859200726/,https://cbsaustin.com/news/local/multiple-boats-in-distress-sinking-at-trump-boat-parade-on-lake-travis,,,
Barrington,283 County Rd,,RI,US,2020-09-05,more than 100,100,,100,,,general protesters,"against racism, against police violence",1,march,,,,,1,1,https://www.facebook.com/events/641379543172741/,https://www.providencejournal.com/news/20200905/black-lives-matter-supporters-hold-march-rally-for-racial-justice-in-barrington,,,,
Bedminster,,,NJ,US,2020-09-05,,,,,,,Somerset County for Trump,"for police, for President Trump, Back the Blue",2,rally,,,,,1,1,https://www.facebook.com/events/315701179473376/,,,,,
Bettendorf,Bettendorf Police Station,,IA,US,2020-09-05,count: FB,79,,79,,,general protesters,"against racism, against police brutality",1,protest,,,,,1,1,https://www.facebook.com/events/685688952025620/,,,,,
Boston,Copley Square,,MA,US,2020-09-05,count: FB,118,,118,,,Civic Youth Summit,"against racism, for defunding police",1,protest,,,,,1,1,https://www.facebook.com/events/2266232210190299/,,,,,
Boston,Copley Square,,MA,US,2020-09-05,,,,,,,Refuse Fascism Boston,"for resignation of President Trump, against fascism, against racism, against police violence",1,protest,,,,,0,1,https://www.facebook.com/events/220447922601168/,,,Trump/Pence Out Now,,
Buford,Lake Lanier,,GA,US,2020-09-05,estimated between 3000 and 3100; 3000 to 4000,3000,,4000,,,general protesters,for President Trump,2,boat parade,0,0,0,0,1,1,https://www.ajc.com/news/lake-lanier-parade-draws-thousands-of-boaters-trump-fans/ZHX6BZR3VNFQ3EBYHGRAUQ3ESM/,,,Great American Boat Parade,,
Burlington,Battery Park,,VT,US,2020-09-05,,,,,,,general protesters,"against racism, against police violence",1,encampment; march,,,,,1,1,https://www.wcax.com/2020/09/09/burlington-city-council-holds-emergency-meeting-to-hear-from-protesters/,,,,,
Charlotte,Marshall Park,,NC,US,2020-09-05,,,,,,,general protesters,"for resignation of President Trump, against fascism, against racism, against police violence, for LGBTQ rights, for women's rights, for immigrants' rights, for First Amendment rights",1,protest,,,,,1,1,https://www.facebook.com/events/1182548732144134/,,,Trump/Pence Out Now,,
Chicago,Federal Plaza,,IL,US,2020-09-05,,,,,,,"Freedom First International, Revolution Club Chicago","for resignation of President Trump, against fascism, against racism, against police violence",1,protest,,,,,1,1,https://www.facebook.com/events/1024818871284239/,,,Trump/Pence Out Now,,
Chicago,ABC7 Chicago,,IL,US,2020-09-05,count: FB,27,,27,,,general protesters,"against child sex trafficking, #SaveOurChildren",0,protest,,,,,0,1,https://www.facebook.com/events/750416592442678,,,,,
Clarksville,Johnson County Courthouse,,AR,US,2020-09-05,count: FB,109,,109,,,general protesters,"against racism, against police violence",1,rally,,,,,1,1,https://www.facebook.com/events/348528919479822/,,,,,
Cleveland,Market Square,,OH,US,2020-09-05,count: FB,30,,30,,,Refuse Fascism; Refuse Fascism Ohio,"for resignation of President Trump, against fascism, against racism, against police violence",1,protest,,,,,1,1,https://www.facebook.com/events/332592568101124/,,,Trump/Pence Out Now,,
Cleveland,Burke Lakefront Airport,,OH,US,2020-09-05,,,,,,,general protesters,for President Trump,2,boat parade,,,,,0,1,https://www.clevescene.com/scene-and-heard/archives/2020/09/05/a-trump-boat-parade-brings-hundreds-of-maga-supporters-to-lake-erie-today,,,Trump Day Northeast Ohio Boat Parade,,
Colorado Springs,30 S Nevada Ave,,CO,US,2020-09-05,count video,12,,12,,,Colorado Springs CounterPropoganda,"against racism, against police violence",1,protest; march,,,,,1,1,https://www.fox21news.com/top-stories/protest-against-police-violence-and-systemic-racism-taking-place-in-colorado-springs/,https://www.facebook.com/events/1190300601369374,,,,
Dallas,Victory Park,,TX,US,2020-09-05,count: FB,26,,26,,,Libertarian Party of Dallas County; Give Hale for Congress 2020; #LetHerSpeak2,for libertarianism,0,protest; car caravan,,,,,1,1,https://www.facebook.com/events/1148502248868219/,,,,,
Dallas,Southern Methodist University,,TX,US,2020-09-05,hundreds,200,,200,,,The Association of Black Students,"against racism, against police violence",1,march,,,,,0,1,https://www.dallasnews.com/news/2020/09/05/hundreds-gather-at-smu-march-through-highland-park-to-protest-brutality-inequities-faced-by-blacks/,,,,,
Dallas,City Hall,,CA,US,2020-09-05,dozens,24,,24,,,Not My Son,anitracism; against police brutality,1,protest,0,0,0,0,0,1,https://www.nbcdfw.com/news/local/protesters-rally-in-dallas-100-days-after-floyds-death-hope-to-reignite-calls-for-change/2439178/,,,,,
Dallas,Highland Park Village Center,,TX,US,2020-09-05,smaller group,,,,,,In Solidarity; People Against the System,"against racism, against police violence",1,march,,,,,0,1,https://www.dallasnews.com/news/2020/09/05/hundreds-gather-at-smu-march-through-highland-park-to-protest-brutality-inequities-faced-by-blacks/,,,,,
Denver,Larimer Square; Union Station,,CO,US,2020-09-05,about 75,75,,75,,,general protesters,"against racism, against police violence",1,march,,,,,1,1,https://www.cpr.org/2020/09/12/armored-groups-are-playing-late-night-cat-and-mouse-at-downtown-denver-protests/,,,,,
Detroit,Federal Building,,MI,US,2020-09-05,,,,,,,Refuse Fascism; Refuse Fascism - Detroit Area,"for resignation of President Trump, against fascism, against racism, against police violence",1,protest,,,,,1,1,https://www.facebook.com/events/313515009840091/,,,Trump/Pence Out Now,,
Detroit,Hockeytown Cafe,,MI,US,2020-09-05,count: FB,35,,35,,,general protesters,"against pedophelia, against child sex trafficking",0,march,,,,,0,1,https://www.facebook.com/events/770536407035004/,,,#SaveOurChildren,,
Detroit,Campus Martius Park,,MI,US,2020-09-05,roughly 300; at least 500,300,,500,,,Detroit Will Breathe,"against racism, against police violence",1,march,,,,1,0,1,https://www.freep.com/story/news/local/michigan/detroit/2020/09/06/macomb-monument-defaced-black-lives-matter-protests/5733855002/,https://www.freep.com/story/news/local/michigan/detroit/2020/09/05/detroit-protests-100-days-end-police-brutality/5730882002/,https://www.clickondetroit.com/news/local/2020/09/06/demonstrators-celebrate-federal-judges-ruling-on-100th-day-of-protesting-in-detroit/,Article notes that group has protested for 100 consecutive days in Detroit.,,
Exeter,Swasey Park,,NH,US,2020-09-05,count: FB,152,,152,,,Black Lives Matter Seacoast,"against racism, against police violence",1,rally,,,,,1,1,https://www.facebook.com/events/2731310377139251/,,,,,
Gettysburg,15 Lincoln Sq,,PA,US,2020-09-05,count: FB,27,,27,,,Save Our Peoples,"against racism, against police violence",1,protest,,,,,1,1,https://www.facebook.com/events/3220790301302958/,,,,,
Groton,Poquonnock Plains Park,,CT,US,2020-09-05,count: FB,29,,29,,,general protesters,"against racism, against police violence",1,march,,,,,1,1,https://www.facebook.com/events/693570334838722/,,,,,
Honolulu,Gateway Park,,HI,US,2020-09-05,count: FB,5,,5,,,Refuse Fascism; Refuse Fascism Honolulu,"for resignation of President Trump, against fascism, against racism, against police violence",1,protest,,,,,1,1,https://www.facebook.com/events/3331864333569871/,,,Trump/Pence Out Now,,
Houston,Houston City Hall,,TX,US,2020-09-05,,,,,,,Refuse Fascism; Refuse Fascism Texas,"for resignation of President Trump, against fascism, against racism, against police violence",1,protest,,,,,1,1,https://www.facebook.com/events/748210905740795/,,,Trump/Pence Out Now,,
Kansas City,47th St and Main St,,MO,US,2020-09-05,,,,,,,Refuse Fascism,"for resignation of President Trump, against fascism, against racism, against police violence",1,protest,,,,,1,1,https://twitter.com/RefuseFascismLA/status/1298803481000771585/photo/1,,,Trump/Pence Out Now,,
Lake Havasu City,Lake Havasu,,AZ,US,2020-09-05,thousands,2000,,2000,,,general protesters,for President Trump,2,boat parade,,,,,1,1,https://twitter.com/alexvnews/status/1302310238834491392,,,,,
Lansing,Michigan State Capitol,,MI,US,2020-09-05,count: FB,124,,124,,,general protesters,"against closures of schools and businesses due to COVID-19, against tyranny, for freedom",2,protest,,,,,1,1,https://www.facebook.com/events/1731581750332689/,,,,,
Libby,Moody's,,MT,US,2020-09-05,around 20,20,,20,,,general protesters,"against child sex trafficking, #SaveOurChildren",0,rally,,,,,1,1,https://thewesternnews.com/news/2020/sep/08/child-trafficking-awareness-rally-draws-small-crow/,,,,,
